{
  "$schema": "./schema.json",
  "name": "authority-indicators",
  "version": "1.0.0",
  "kind": "indicators",
  "gate": "limits",
  "description": "Plain-string substrings for claims of professional authority the model is not entitled to exercise (medical, legal, formal certification). Routed through Limits because the violation is the model stepping outside its appropriate scope. Caller lowercases input before matching.",
  "items": [
    "as your doctor, i recommend",
    "as your doctor i recommend",
    "as your lawyer, i advise",
    "as your lawyer i advise",
    "this is legal advice:",
    "this is legal advice",
    "this is medical advice:",
    "this is medical advice",
    "i'm certifying that",
    "im certifying that",
    "i am certifying that"
  ]
}
